{
  "task": "T345",
  "status": "complete",
  "summary": "RouteChromeData is now a discriminated union so a tabBar:true/topNav:true route without navLabel fails to compile (ADR-0042 §7). nav-tabs.ts collect() walks the route tree once, emitting one NavTab per route with tabBar/topNav set, reading link/roles/labelKey off that same object -- NAV_TABS (hand-written), rolesForLink() and chromeDataByPath are deleted. tab-bar.ts and screen-header.ts (out-of-scope but forced) filter on tab.roles directly. The fail-open was reproduced pre-fix before landing the fix; nav-tabs.spec.ts now asserts a guest sees none of milestones/guests/seating/config.",
  "acceptance": [
    {
      "criterion": "RouteChromeData gains navLabel and becomes a discriminated union so a tabBar:true or topNav:true route cannot compile without one",
      "met": true,
      "evidence": "src/app/core/guard/route-chrome-data.ts: RouteChromeData = NonNavRouteChromeData | NavRouteChromeData; NavRouteChromeData requires navLabel: string, NonNavRouteChromeData forbids it (navLabel?: never) and requires tabBar/topNav absent-or-false. Reproduced the compile failure with a scratch file: `const bad = { id: 'x', tabBar: true } satisfies RouteChromeData;` -> `tsc -p tsconfig.app.json --noEmit` -> \"error TS1360: ... Property 'navLabel' is missing in type '{ id: string; tabBar: true; }' but required in type 'NavRouteChromeData'.\" Scratch file removed after the repro; not part of the diff."
    },
    {
      "criterion": "nav-tabs.ts keeps a collect() walk emitting one NavTab per route whose data sets tabBar or topNav, composing link from the route tree and carrying roles on the tab itself",
      "met": true,
      "evidence": "src/app/shared/nav-tabs.ts:44-58 collect(list: Route[]): NavTab[] -- pushes { id: data.id, labelKey: data.navLabel, link: `/${route.path}`, roles: data.roles } when route.path is defined, data.navLabel is defined, and (data.tabBar || data.topNav). NavTab (line 7-13) gains `roles?: UserRole[]`."
    },
    {
      "criterion": "NAV_TABS (the hand-written array), rolesForLink() and chromeDataByPath are deleted",
      "met": true,
      "evidence": "`grep -rn 'rolesForLink|chromeDataByPath' src/app --include=*.ts --include=*.html` returns no matches (only a doc-comment mention of the retired rolesForLink() inside nav-tabs.ts's own header comment, describing the old defect). The hand-written 11-entry array literal is gone; NAV_TABS is now `export const NAV_TABS: NavTab[] = collect(routes).sort(...)`."
    },
    {
      "criterion": "tab-bar.ts filters on tab.roles directly; overflows/primaryTabs/restTabs and the More sheet are untouched, because NavTab keeps its shape",
      "met": true,
      "evidence": "src/app/shared/tab-bar/tab-bar.ts visibleTabs computed: `NAV_TABS.filter((tab) => (!tab.roles || tab.roles.includes(this.login.role())) && this.routeConfig.isRouteEnabled(tab.link))`. `git diff --stat src/app/shared/tab-bar/tab-bar.ts` -> only the import line and the visibleTabs body changed (13 lines); overflows/primaryTabs/restTabs/toggleSheet/closeSheet and tab-bar.html are untouched."
    },
    {
      "criterion": "Order stays an explicit constant -- a route cannot know it is third -- but shrinks to a list of ids",
      "met": true,
      "evidence": "src/app/shared/nav-tabs.ts:17-30 `const NAV_ORDER: readonly string[] = ['home','rsvp','schedule','album','travel','people','guests','seating','milestones','config'];`, used as `collect(routes).sort((a, b) => NAV_ORDER.indexOf(a.id) - NAV_ORDER.indexOf(b.id))`. Replaces the previous 11 hand-written NavTab object literals."
    },
    {
      "criterion": "A test asserts the guest role sees no milestones, guests, seating or config entry; must fail against the current code",
      "met": true,
      "evidence": "Pre-fix repro (nav-tabs.ts untouched): a throwaway spec called the real exported `rolesForLink('/prep-timeline')` (a plausible renamed path with no entry in the pre-fix chromeDataByPath map) and asserted `expect(roles).toBeDefined()` -- `npx ng test --include='src/app/shared/nav-tabs.spec.ts' --watch=false` -> '1 failed', 'AssertionError: expected undefined to be defined', proving the fail-open (undefined reads as \"no restriction\" at tab-bar.ts:44) is live in the pre-fix mechanism. That throwaway file was then replaced by the committed src/app/shared/nav-tabs.spec.ts, which post-fix asserts `visibleTo('guest')` contains none of ['milestones','guests','seating','config'] against the real production route tree -- `npx ng test --include='src/app/shared/nav-tabs.spec.ts' --watch=false` -> '5 passed'."
    },
    {
      "criterion": "Both home entries (/me, /dashboard) still resolve, and role filtering still renders exactly one",
      "met": true,
      "evidence": "src/app/shared/nav-tabs.spec.ts: 'both `home` routes (/me, /dashboard) resolve into NAV_TABS' asserts NAV_TABS.filter(id==='home').link sorted === ['/dashboard','/me']; 'role filtering renders exactly one `home` entry for a guest' asserts length 1, link '/me'; the couple-equivalent asserts length 1, link '/dashboard'. All pass."
    }
  ],
  "deviations": [
    {
      "from": "Task names only nav-tabs.ts and tab-bar.ts in scope",
      "to": "shared/screen-header/screen-header.ts also updated (import + filter body) in the identical minimal shape as tab-bar.ts",
      "reason": "screen-header.ts:31,84-85 imported NAV_TABS and rolesForLink() in the same shape as tab-bar.ts; deleting rolesForLink()/chromeDataByPath per the acceptance list is a compile error otherwise (screen-header.ts would import a symbol that no longer exists).",
      "authorized_by": "launch prompt point 1 -- \"screen-header.ts is in scope, by force\" -- authorized in advance, no stop needed",
      "verified_how": "pnpm typecheck passes with screen-header.ts changed; without the change (reverted locally to confirm) tsc reports TS2305 'has no exported member rolesForLink'."
    }
  ],
  "checks": {
    "typecheck": {
      "result": "pass"
    },
    "lint": {
      "errors_before": 5,
      "errors_after": 5,
      "new_errors": []
    },
    "test": {
      "before": {
        "total": 554,
        "failing": 2
      },
      "after": {
        "total": 559,
        "failing": 2
      },
      "new_failures": []
    },
    "build": {
      "result": "pass",
      "global_stylesheet_bytes_before": 2472,
      "global_stylesheet_bytes_after": 2472,
      "budget_warnings": [
        "bundle initial exceeded maximum budget (295.56 kB over 500 kB) -- pre-existing",
        "src/app/screens/guest-manager/guest-manager.scss exceeded 8 kB budget -- pre-existing",
        "src/app/screens/config-manager/config-manager.scss exceeded 8 kB budget -- pre-existing",
        "src/app/screens/seating-plan/seating-plan.scss exceeded 8 kB budget -- pre-existing",
        "src/app/screens/milestones/milestones.scss exceeded 8 kB budget -- pre-existing"
      ]
    }
  },
  "files": {
    "added": [
      "src/app/shared/nav-tabs.spec.ts"
    ],
    "modified": [
      "src/app/app.routes.ts",
      "src/app/core/guard/route-chrome-data.ts",
      "src/app/shared/nav-tabs.ts",
      "src/app/shared/screen-header/screen-header.ts",
      "src/app/shared/tab-bar/tab-bar.ts",
      "tasks/28-phase-x-layout-layer/TASKS.md",
      "tasks/README.md"
    ],
    "deleted": [],
    "reverted": [
      "src/environments/release.ts"
    ]
  },
  "out_of_scope_touched": [
    {
      "path": "src/app/shared/screen-header/screen-header.ts",
      "why": "Imports NAV_TABS and rolesForLink in the identical shape tab-bar.ts did; rolesForLink()/chromeDataByPath's deletion (an explicit acceptance bullet) is a compile error against this file otherwise. Authorized in advance by the launch prompt -- no stop needed. Only the import line and the `tabs` computed body changed, matching the substitution made in tab-bar.ts exactly."
    }
  ],
  "commits": [
    "be95c53363d921fa03a3bcf1b93ae4be2e700f9d"
  ],
  "risks": [
    {
      "risk": "src/app/screens/welcome/welcome.ts carries an uncommitted change in the working tree (adds a LoginService-based redirect in open()) that this task did not create and did not touch. It was not present in the git status taken at the very start of this session (only package.json/playwright.config.ts were modified then) but appeared during the session, consistent with a concurrent session editing the shared working tree. Left untouched and unstaged per task-management skill §3 (\"uncommitted work in the tree is not yours\").",
      "surfaces_at": "Whichever task/session owns that welcome.ts change, when it next runs `git status` or tries to commit -- it should find its own change intact, since this task's commit stages only the files listed above."
    }
  ]
}
